
1,1,1,2024-05-25 11:16:03,Great product! Very satisfied with my purchase.
2,2,2,2024-05-25 11:16:03,Excellent service! Quick delivery and good quality.
3,3,3,2024-05-25 11:16:03,The product exceeded my expectations. Highly recommended.
4,4,4,2024-05-25 11:16:03,Love it! Will definitely buy again.
5,5,5,2024-05-25 11:16:03,Fast shipping and well-packaged. Thank you!
6,6,6,2024-05-25 11:16:03,Very stylish design. Fits perfectly in my room.
7,7,7,2024-05-25 11:16:03,Impressed with the durability. Worth every penny.
8,8,8,2024-05-25 11:16:03,Easy to assemble and sturdy construction.
9,9,9,2024-05-25 11:16:03,Exactly what I was looking for. Thank you!
10,10,10,2024-05-25 11:16:03,Fantastic customer support. Resolved my issue promptly.
